advertisement,type,qualities
Nike,brand,"quality, durable, athletic"
Adidas,brand,"performance, style, function"
Under Armour,brand,"advanced technology, comfort, durability"
Fitbit,brand,"fitness tracking, sleek design, healthy living"
Apple Watch, product,"smartwatch, fitness tracking, communication"
Peloton,brand,"home fitness, interactive, community"
Bowflex,brand,"home gym equipment, versatile, durable"
Reebok,brand,"athletic footwear and apparel, performance, style"
Lululemon,brand,"athletic apparel, quality, stylish"
PowerBar,brand,"protein bars, nutrition, energy"
Gatorade,brand,"sports drinks, hydration, endurance"
Optimum Nutrition,brand,"nutritional supplements, performance, recovery"
ProForm,brand,"treadmills, ellipticals, bikes"
Life Fitness,brand,"commercial fitness equipment, durability, quality"
Polar,brand,"heart rate monitors, performance tracking, GPS"
TRX, product,"suspension trainer, functional training, home gym"
Runtastic, app,"running, tracking, motivation"
Garmin,brand,"sports watches, GPS, training"
MyFitnessPal, app,"diet tracking, calorie counting, healthy lifestyle"
Clif Bar,brand,"energy bars, organic ingredients, nutrition"
Asics,brand,"running shoes, comfort, performance"
Zumba,brand,"dance fitness, fun, community"
CrossFit,brand,"functional movement, high-intensity, community"
Planet Fitness,brand,"fitness centers, affordable, accessible"
Rogue Fitness,brand,"strength equipment, commercial quality, durability"
Physique 57,brand,"barre classes, toning, online classes"
Hyperice,brand,"recovery tools, vibration massage, athlete performance"
ON Cloud,brand,"running shoes, lightness, cushioning"
ClassPass, app,"fitness classes, flexible membership, variety"
Bosu, product,"balance trainer, stability, core strength"
Vibram,brand,"barefoot shoes, natural movement, durability"
Quest Nutrition,brand,"protein bars, low carb, taste"
Celsius,brand,"energy drinks, healthy, metabolism booster"
Alo Yoga,brand,"yoga clothing, stylish, quality"
Sweaty Betty,brand,"women's athletic apparel, fashion-forward, quality"
Rumble,brand,"boxing workouts, fun, empowerment"
C9 Champion,brand,"affordable athletic apparel, Target-exclusive, style"
Alani Nu,brand,"nutritional supplements, female-focused, taste"
Gymshark,brand,"athletic apparel, social media presence, style"
C4, product,"pre-workout supplement, energy, focus"
Gold's Gym,brand,"fitness centers, strength training, history"
NOCCO,brand,"no carbs company, BCAA drinks, sugar-free, vitamins"
Puma,brand,"sportswear, performance, fashion"
New Balance,brand,"comfortable, supportive sports shoes"
YogaAddict,brand,"high-quality, comfortable yoga products"
Mirafit,brand,"high-quality, durable weightlifting equipment"
Echelon Fit,brand,"interactive, connected fitness machines"
Theragun, product,"deep-tissue, recovery massage guns"
MyProtein,brand,"affordable,high-quality sports nutrition products"
NordicTrack,brand,"advanced, comprehensive home gym systems"
Suunto,brand,"precise, durable sports watches"
Resistance Bands Set, product,"portable, versatile workout tools"
Cellucor,brand,"effective, reputable sports nutrition supplements"
Sports Research,brand,"premium, beneficial sports nutrition"
Ergatta,brand,"sleek, competition-inspired rower machines"
Six Star Pro Nutrition,brand,"high-quality, value sports supplements"
Inov-8,brand,"sturdy, lightweight cross-training shoes"
Superdry Sport,brand,"comfortable, cool-looking activewear"
Tonal,brand,"intelligent, compact home gym systems"
Fabletics,brand,"affordable, trendy activewear for women"
Tempo Studio,brand,"AI-powered, interactive home gym"
SandBell, product,"versatile, soft-weighted training tool"
Schwinn,brand,"state-of-the-art, user-friendly exercise bikes"
Slendertone, product,"clinically-proven, body-toning devices"
Phd,brand,"effective, researched sports nutrition products"
GoPro,brand,"compact, hi-res workout filming gear"
MuscleTech,brand,"advanced, science-backed sports supplements"
Les Mills,brand,"energetic, inspiring workout programs"
Personal Blender, product,"portable, easy-to-use smoothie makers"
Horizon Fitness,brand,"cutting-edge, space-saving workout equipment"
Protein World,brand,"nutrition-focused, clean, tasty protein powders"
Insanity Workout,product,"intense, high energy, results-driven home workout program"
P90X, product,"comprehensive, muscle-building home workout system"
Beachbody On Demand, service,"diverse, on-demand workout programs"
Yoga Burn, product,"progressive, women-focused, wellness-centric yoga program"
Sweat app,service,"personalized, women-focused workout programs"
Kaged Muscle,brand,"pharmaceutical-grade, high-quality, pure workout supplements"
Zwift,service,"immersive, gamified indoor cycling & running workout"
Bose,brand,high-quality workout-friendly headphones
Jaybird,brand,"compact, sweat-resistant, high-quality sport headphones"
Alo,brand,"luxurious, eco-friendly yoga clothing and accessories"
Brooks,brand,"well-crafted, comfortable, supportive running shoes"
Skullcandy,brand,"stylish, long-lasting, workout-friendly headphones"
Jillian Michaels Fitness App, Service,"comprehensive exercise, meal plans and tracking"
TRX Training System, product,"versatile, space-saving full-body workout system"
Cybex,brand,"innovative, biomechanically designed fitness equipment"
Total Gym, product,"compact, versatile whole body home workout equipment"
Sole Fitness,brand,"sturdy, efficient, low-impact home perfect for cardio"
Zella,brand,"affordable, trendy, high-quality activewear"
Crossrope, product,"weighted, durable, efficient fitness jump ropes"
Merrell,brand,"durable, supportive, outdoor running shoes"
Yogi Bare,brand,"eco-friendly, innovative, non-slip yoga mats"
Vega,brand,"plant-based, nutrient-dense, tasty protein powders"
Jym Supplement Science,brand,"science-backed, effective, high-quality workout supplements"
Fitbod, service,"AI-powered, personalized, easy-to-follow workout plans"
TRX Suspension Training, product,body-weight exercises for strength and flexibility
Octane Fitness,brand,"low-impact, innovative, commercial grade workout equipment"
Zoggs,brand,"swimming equipment's, durability, advanced technology"
Roxy,brand,"women's outdoor fitness attire, style, durability"
Hoka One One,brand,"running shoes, comfort,lightweight"
